{
  "version": "0.1",
  "capture_id": "openai_responses_fixture",
  "observed_at_unix_ms": 1784071000000,
  "source": "mitmproxy",
  "request": {
    "method": "POST",
    "scheme": "https",
    "host": "api.openai.com",
    "port": 443,
    "path": "/v1/responses",
    "query": [],
    "headers": [{ "name": "content-type", "value": "application/json" }],
    "body": {
      "state": "json",
      "content": {
        "model": "gpt-5.2",
        "instructions": "Act as a precise repository maintainer.",
        "input": [
          {
            "role": "user",
            "content": [
              { "type": "input_text", "text": "Fix the parser without changing public behavior." },
              { "type": "input_image", "image_url": "https://example.invalid/diagram.png" }
            ]
          },
          {
            "type": "function_call",
            "call_id": "call_read",
            "name": "read_file",
            "arguments": "{\"path\":\"src/parser.rs\"}"
          },
          {
            "type": "function_call_output",
            "call_id": "call_read",
            "output": { "lines": 120, "language": "rust" }
          }
        ],
        "tools": [
          {
            "type": "function",
            "name": "read_file",
            "description": "Read a UTF-8 source file.",
            "parameters": {
              "type": "object",
              "properties": { "path": { "type": "string" } },
              "required": ["path"]
            }
          }
        ],
        "temperature": 0.2,
        "top_p": 0.9,
        "max_output_tokens": 2048,
        "stream": true,
        "parallel_tool_calls": false
      }
    }
  },
  "redactions": [{ "location": "header", "name": "authorization" }]
}
