{
  "version": "0.1",
  "capture_id": "anthropic_messages_fixture",
  "observed_at_unix_ms": 1784072000000,
  "source": "gateway",
  "request": {
    "method": "POST",
    "scheme": "https",
    "host": "api.anthropic.com",
    "port": 443,
    "path": "/v1/messages",
    "query": [],
    "headers": [
      { "name": "content-type", "value": "application/json" },
      { "name": "anthropic-version", "value": "2023-06-01" },
      { "name": "x-api-key", "value": "anthropic-fixture-canary" }
    ],
    "body": {
      "state": "json",
      "content": {
        "model": "claude-sonnet-4-5",
        "max_tokens": 2048,
        "system": [
          {
            "type": "text",
            "text": "You are a careful coding assistant.",
            "cache_control": { "type": "ephemeral" }
          }
        ],
        "messages": [
          {
            "role": "user",
            "content": [
              { "type": "text", "text": "Read Cargo.toml and summarize the workspace." },
              {
                "type": "image",
                "source": {
                  "type": "base64",
                  "media_type": "image/png",
                  "data": "fixture-image-data"
                }
              }
            ]
          },
          {
            "role": "assistant",
            "content": [
              {
                "type": "tool_use",
                "id": "toolu_read_1",
                "name": "read_file",
                "input": { "path": "Cargo.toml" }
              }
            ]
          },
          {
            "role": "user",
            "content": [
              {
                "type": "tool_result",
                "tool_use_id": "toolu_read_1",
                "content": "[workspace]\nmembers = [\"crates/adapters\"]"
              }
            ]
          }
        ],
        "tools": [
          {
            "name": "read_file",
            "description": "Read a UTF-8 file from the workspace.",
            "input_schema": {
              "type": "object",
              "properties": { "path": { "type": "string" } },
              "required": ["path"]
            }
          }
        ],
        "temperature": 0.0,
        "top_p": 0.9,
        "top_k": 40,
        "stop_sequences": ["</done>"],
        "stream": true,
        "tool_choice": { "type": "auto" }
      }
    }
  },
  "redactions": []
}
